{
  "$schema": "https://json-schema.org/draft/2020-12/schema",
  "$id": "https://hacp.example/schemas/v0.2-draft/authority-packet.schema.json",
  "title": "HACP 0.2 Draft Authority Packet",
  "type": "object",
  "additionalProperties": false,
  "required": [
    "schemaVersion",
    "recordKind",
    "authorityPacketId",
    "createdAt",
    "createdBy",
    "approval",
    "scope",
    "authority",
    "allowedSurfaces",
    "forbiddenSurfaces",
    "stopConditions",
    "verificationExpectations",
    "requestedReportShape",
    "digest"
  ],
  "properties": {
    "schemaVersion": { "const": "hacp-0.2-draft" },
    "recordKind": { "const": "hacp.authority_packet" },
    "authorityPacketId": { "type": "string", "minLength": 1 },
    "createdAt": { "type": "string", "format": "date-time" },
    "createdBy": { "type": "string", "minLength": 1 },
    "approval": {
      "type": "object",
      "additionalProperties": false,
      "required": ["actorId", "actorKind", "approvedAt", "approvalDigest"],
      "properties": {
        "actorId": { "type": "string", "minLength": 1 },
        "actorKind": { "const": "human" },
        "approvedAt": { "type": "string", "format": "date-time" },
        "approvalDigest": {
          "allOf": [
            { "$ref": "#/$defs/digest" },
            { "properties": { "digestDomain": { "const": "authority_packet_approval_v0.2" } } }
          ]
        }
      }
    },
    "scope": { "type": "string", "minLength": 1 },
    "authority": {
      "type": "object",
      "additionalProperties": false,
      "required": ["mode", "impact", "decisionBoundary"],
      "properties": {
        "mode": {
          "enum": ["observe_only", "review_only", "verify_only", "propose_only", "implement_bounded"]
        },
        "impact": {
          "enum": [
            "observes_state_only",
            "returns_findings_only",
            "returns_verification_only",
            "produces_proposal",
            "modifies_allowed_surfaces"
          ]
        },
        "decisionBoundary": {
          "type": "string",
          "minLength": 1,
          "description": "Human-only decisions that remain outside adapter authority."
        }
      }
    },
    "allowedSurfaces": {
      "type": "array",
      "items": { "type": "string", "minLength": 1 },
      "minItems": 1
    },
    "forbiddenSurfaces": {
      "type": "array",
      "items": { "type": "string", "minLength": 1 }
    },
    "stopConditions": {
      "type": "array",
      "items": { "type": "string", "minLength": 1 },
      "minItems": 1
    },
    "verificationExpectations": {
      "type": "array",
      "items": { "type": "string", "minLength": 1 }
    },
    "requestedReportShape": { "enum": ["hacp.adapter_report"] },
    "digest": {
      "allOf": [
        { "$ref": "#/$defs/digest" },
        { "properties": { "digestDomain": { "const": "authority_packet_v0.2" } } }
      ]
    }
  },
  "$defs": {
    "digest": {
      "type": "object",
      "additionalProperties": false,
      "required": ["algorithm", "canonicalization", "digestDomain", "value"],
      "properties": {
        "algorithm": { "const": "sha256" },
        "canonicalization": { "const": "json-rfc8785-jcs" },
        "digestDomain": {
          "enum": [
            "authority_packet_approval_v0.2",
            "authority_packet_v0.2",
            "handoff_package_v0.2",
            "adapter_report_v0.2",
            "match_proof_v0.2",
            "human_decision_record_v0.2",
            "legacy_free_text_report"
          ]
        },
        "value": { "type": "string", "pattern": "^[0-9a-f]{64}$" }
      }
    }
  }
}
